Title,Answer
Акция,"поставщики ЖКХ услуг акции, о списании пени, не заявили | До 31 декабря 2022 проходит акция «Счастливый платеж» | участвуя в акции «Счастливый платеж» вы можете выиграть 1500 рублей на лицевой счет | Для участия в акции «Счастливый платеж» нужно оплатить все квитанции за электроэнергию, в том числе и за декабрь впллоть до 31 декабря | в акции «Счастливый платеж» разыгрывается 100 призов | список победителей в акции счастливый платеж будет опубликован 17 января на сайте"
Договор,"Форма договора энергоснабжения представлена на сайте компании | Для получения официального экземпляра договора нужно обратиться в подразделение ПАО Пермэнергосбыт | направьте онлайн обращение на сайте ПАО Пермэнергосбыт, раздел - Все сервисы в один клик"
Ремонт линий энергопередач,"ПАО Пермэнергосбыт не осуществляет ремонт или замену опор линий электропередачи | ремонт осуществляет ПАО Россети Урала"
СНТ Лесной,"В СНТ установлен общедомовой прибор учета энергии (ОДПУ) | расчет потребления на одну душу населения осуществляется по показаниям | Объем электроэнергии рассчитывается и распределяется между потребителями пропорционально размеру общей площади принадлежащего каждому потребителю жилого помещения находящегося в его пользовании | Величина расхода электроэнергии является расчётной | Величина расхода электроэнергии может меняться каждый месяц | ПАО Пермэнергосбыт производит начисление согласно действующему Законодательству"
Технический сбой на сайте ПАО Пермэнергосбыт,"Наблюдаются сложности при оформлении онлайн заявлений | Специалисты работают над устранением проблемы | нужно попробовать подать заявление позднее | мобильное приложение "Пермэнергосбыт" успешно функционирует"
Перерасчет за Горячее ВодоСнабжение,"Перерасчет начислений за горячее водоснабжение производится на основании информации поступающей от поставщика услуги | сведения о временном отсутствии услуги отсутствуют | Перерасчет будет произведен после поступления и обработки данных"
Многодетные семьи,"Повышение тарифа коснётся абсолютно всех потребителей электрической энергии | дифференцированные тарифы не применяются при заполнении заявления общего характера | к заявлению нужно приложить удостоверение многодетной семьи"
Система Быстрых Платежей,"По техническим причинам при оплате с помощью СБП может возникнуть сложность | лучше произвести оплату картой"